companyName,symbol,dividend_Ex_Date,payment_Date,record_Date,dividend_Rate,indicated_Annual_Dividend,announcement_Date
Eagle Point Credit Company Inc. Common Stock,ECC,1/10/2024,1/31/2024,1/11/2024,0.02,1.68,11/08/2023
Eagle Point Credit Company Inc. Common Stock,ECC,1/10/2024,1/31/2024,1/11/2024,0.14,1.68,11/08/2023
Eagle Point Income Company Inc. Common Stock,EIC,1/10/2024,1/31/2024,1/11/2024,0.2,2.16,11/08/2023
Eagle Point Credit Company Inc. 6.50% Series C Term Preferred Stock due 2031,ECCC,1/10/2024,1/31/2024,1/11/2024,0.135417,1.625,11/08/2023
Eagle Point Income Company Inc. 5.00% Series A Term Preferred Stock due 2026,EICA,1/10/2024,1/31/2024,1/11/2024,0.104167,1.25,11/08/2023
